{
  "name": "Person LÃ¶schen",
  "delete": {},
  "from": {
    "first": {
      "name": "person"
    }
  },
  "where": {
    "first": {
      "binary": {
        "lhs": {
          "singleColumn": {
            "column": "person_id",
            "table": "person"
          }
        },
        "rhs": {
          "parameter": {
            "key": "id"
          }
        },
        "operator": "=",
        "simple": true
      }
    }
  }
}
