{
  "name": "key_value 1",
  "from": {
    "first": {
      "name": "key_value"
    }
  },
  "select": {
    "columns": [
      {
        "expr": {
          "star": {}
        }
      },
      {
        "expr": {
          "singleColumn": {
            "column": "key",
            "table": "key_value"
          }
        }
      }
    ]
  },
  "where": {
    "first": {
      "binary": {
        "lhs": {
          "singleColumn": {
            "column": "key",
            "table": "key_value"
          }
        },
        "rhs": {
          "singleColumn": {
            "column": "key",
            "table": "key_value"
          }
        },
        "operator": "=",
        "simple": true
      }
    }
  }
}
