{"name":"Ereignisse","from":{"first":{"name":"ereignis"},"joins":[{"table":{"name":"person"},"cross":"cross"}]},"select":{"columns":[{"expr":{"singleColumn":{"column":"vorname","table":"person"}}}]},"where":{"first":{"binary":{"lhs":{"constant":{"type":"INTEGER","value":"1"}},"rhs":{"constant":{"type":"INTEGER","value":"71"}},"operator":"<=","simple":true}}},"id":"b0c224ac-efd2-4f46-bec0-b7bca7058a82"}