{
  "name": "Test 2",
  "from": {
    "first": {
      "name": "key_value"
    }
  },
  "select": {
    "columns": [
      {
        "expr": {
          "star": {}
        }
      }
    ]
  },
  "where": {
    "first": {
      "binary": {
        "lhs": {
          "singleColumn": {
            "column": "key",
            "table": "key_value"
          }
        },
        "rhs": {
          "constant": {
            "type": "INTEGER",
            "value": "3"
          }
        },
        "operator": "=",
        "simple": true
      }
    }
  },
  "id": "e2fb27a9-917c-4411-a26d-1a253aabb1bb"
}
